{
  "format": "face-unlock-detector-output",
  "format_version": 1,
  "created_at": "2026-08-19T00:00:00Z",
  "backend": "haar",
  "source": {
    "type": "camera",
    "camera_index": 0,
    "frame_width": 640,
    "frame_height": 480
  },
  "summary": {
    "frames_total": 100,
    "detections_total": 25,
    "mean_detect_ms": 4.2
  },
  "frames": [
    {
      "timestamp": 1787097600.0,
      "frame_index": 1,
      "detect_ms": 4.1,
      "detections": [
        {
          "x": 200,
          "y": 120,
          "w": 160,
          "h": 160,
          "score": 1.0,
          "backend": "haar"
        }
      ]
    }
  ],
  "privacy": {
    "raw_images_included": false,
    "face_crops_included": false,
    "safe_to_commit": false
  },
  "warnings": [
    "example only",
    "detection metadata may be biometric-adjacent"
  ]
}
